<?xml version="1.0" encoding="UTF-8"?>
<bankDB xmlns:xsi="http://www.w3.org/2001/XMLSchema-instance"
        xsi:noNamespaceSchemaLocation="bankDB.xsd">
    <customer>
        <customerId>1</customerId>
        <firstName>John</firstName>
        <lastName>Doe</lastName>
        <address>123 Main St</address>
        <phoneNumber>123-456-7890</phoneNumber>
        <email>johndoe@example.com</email>
        <creditCards>
            <creditCard>
                <creditCardId>1</creditCardId>
                <customerId>1</customerId>
                <creditCardNumber>1234567890123456</creditCardNumber>
                <expiryDate>2023-06-30</expiryDate>
                <creditLimit>5000.0</creditLimit>
                <outstandingBalance>2500.0</outstandingBalance>
            </creditCard>
        </creditCards>
        <debitCards>
            <debitCard>
                <cardId>1</cardId>
                <customerId>1</customerId>
                <cardNumber>9876543210987654</cardNumber>
                <expirationDate>2023-06-30</expirationDate>
            </debitCard>
        </debitCards>
        <loans>
            <loan>
                <loanId>1</loanId>
                <customerId>1</customerId>
                <loanType>Home Loan</loanType>
                <loanAmount>200000.0</loanAmount>
                <interestRate>4.5</interestRate>
                <startDate>2023-06-01</startDate>
                <endDate>2043-06-01</endDate>
            </loan>
        </loans>
    </customer>
    <transaction>
        <transactionId>1</transactionId>
        <transactionTypes>
            <transactionType>
                <typeId>1</typeId>
                <typeName>Deposit</typeName>
            </transactionType>
        </transactionTypes>
        <accountId>1</accountId>
        <amount>1000.0</amount>
        <transactionDate>2023-06-01</transactionDate>
        <sourceAccountId>0</sourceAccountId>
        <destinationAccountId>1</destinationAccountId>
    </transaction>
    <branch>
        <branchId>1</branchId>
        <branchName>Main Branch</branchName>
        <location>123 Main St</location>
        <branchEmployees>
            <branchEmployee>
                <employeeId>1</employeeId>
                <firstName>Jane</firstName>
                <lastName>Smith</lastName>
                <branchId>1</branchId>
                <position>Teller</position>
            </branchEmployee>
        </branchEmployees>
    </branch>
</bankDB>
